{
  "schema_version": "1.0.0",
  "as_of": "2026-10-20",
  "register": "Forward-looking. No current-state numbers appear on this page \u2014 those live in `docs/critical/REPO_STATE.md` and on the Goals & tasks page, and change faster than prose can track.",
  "sources": [
    {
      "file": "docs/goals/VISION.md",
      "written": "2026-09-13",
      "covers": "The mandate, the name, the evidence-gates-versus-risk-caps distinction, the risk ladder, the profit target and its arithmetic, the four phases, the anti-goals",
      "revision_rule": "Revised when the destination or the mandate changes \u2014 not when the situation does. A phase that has passed unmet gets a dated note rather than a slid date."
    },
    {
      "file": "docs/goals/IDENTITY_AND_HABITS.md",
      "written": "2026-09-13",
      "covers": "Who has to exist for the vision to happen: goals \u2192 why \u2192 beliefs \u2192 identity \u2192 habits \u2192 skills, for the owner and for every agent working in the repo",
      "revision_rule": "Revised on conflict. When identity and vision disagree, the conflict is written down here rather than resolved silently."
    },
    {
      "file": "docs/goals/VALUE_MILESTONES.md",
      "written": "2026-08-13",
      "covers": "The falsifiable rungs M0\u2013M4, each tied to a blocker that exists in the repo",
      "revision_rule": "Revised when a rung moves. Rendered on the Goals & tasks page as the ladder."
    }
  ],
  "headline": {
    "one_line": "Compound a small account into real capital, at a rate we choose deliberately, without ever fooling ourselves about whether it's working.",
    "technical": "Both halves are load-bearing and the order matters. The first half is the purpose: this is a wealth-accumulation machine, and every design decision must eventually answer to a return figure. The second half is the only reason the first is achievable \u2014 an edge you believe in because you never tested it honestly is worth less than no edge, since it spends real money before it disappoints you.",
    "plain": "The point is to turn a small amount of money into a real amount of money, on purpose and at a speed we picked. The second half of the sentence is what makes the first half possible: if you never check honestly whether a strategy works, you will spend real money finding out the expensive way.",
    "not": [
      "Not \"a system that proves it shouldn't trade.\"",
      "Not \"a system that trades whatever it's handed.\"",
      "**A compounder that refuses to lie to itself.**"
    ]
  },
  "owner_decisions": {
    "date": "2026-09-13",
    "note": "Four decisions taken by the owner on this date, encoded in the vision rather than argued about again.",
    "items": [
      {
        "title": "The first target is cumulative profit",
        "text": "~$100k in **cumulative profit** \u2014 not account value, not capital deposited."
      },
      {
        "title": "Starting capital is $100, for testing",
        "text": "Deposits are decided later, on evidence, as a named decision rather than a drift."
      },
      {
        "title": "Risk is uncapped in demo",
        "text": "Caps are introduced tier by tier, each on explicit owner sign-off, and never applied in advance of the tier they govern."
      },
      {
        "title": "The evidence chain closes before live capital",
        "text": "Phase 0 finishes before any real money is risked. This orders the whole plan."
      },
      {
        "title": "Full local consolidation on Computer 4",
        "text": "Cut GCP entirely and run S1, S2, and S3 locally on Computer 4 (Windows 11, RTX 5070). Zero cloud hosting fees, zero network lag."
      },
      {
        "title": "Research Standard v2 \u2014 Macro premia & ensembles",
        "text": "Retire single-pair technical indicator optimization. Edge lies in slow economic premia, currency baskets, and combining weak signals into equal-risk committees (H-20261019-04)."
      }
    ]
  },
  "future_device_upgrade": {
    "title": "Future device upgrade",
    "technical": "If this machine becomes the single always-on host for Systems 1, 2 and 3, buy the smallest reliable ATX Linux platform that can run the services continuously, then upgrade only when measurements or an operational requirement justify it. The first build must include power protection, backups and recovery procedures; a GPU and large capacity are optional stages, not entry requirements.",
    "plain": "Start with a dependable Linux desktop that can run everything, but do not buy the biggest machine on day one. Add memory, mirrored storage, a second host and a GPU only when the workload or the money at risk makes them necessary.",
    "funding_rule": {
      "title": "Build it from realized profits",
      "technical": "Do not fund the computer from deposits, borrowed money, or unrealized gains. After a sustained profitable period, move only a pre-decided share of realized net profit into a separate hardware fund. The fund must not reduce broker margin, operating reserves, emergency savings, or the risk budget required by the current system.",
      "plain": "Let the system pay for its own upgrade. Only use money the system has actually earned, set it aside separately, and never take money needed for trading, bills, or recovery."
    },
    "requirements": [
      [
        "CPU",
        "12-core AMD Ryzen 9 on AM5, or a current equivalent; 16 cores later",
        "Enough parallelism for all three systems and ordinary research"
      ],
      [
        "Memory",
        "64 GB DDR5 initially; expand to 128 GB when memory pressure is measured",
        "Runs the services and moderate research without paying for unused capacity"
      ],
      [
        "GPU",
        "No dedicated GPU initially; add NVIDIA 16-24 GB VRAM only for measured local ML demand",
        "Ingestion, PostgreSQL and execution do not require a GPU"
      ],
      [
        "Storage",
        "One reliable 2 TB NVMe initially; add mirrored/enterprise storage before meaningful live capital",
        "Keeps the starting build simple while defining the reliability upgrade"
      ],
      [
        "Expansion",
        "ATX case and motherboard, four RAM slots, multiple NVMe slots, wired Ethernet",
        "Allows staged RAM, storage and GPU upgrades"
      ],
      [
        "Power and cooling",
        "850 W 80+ Gold PSU and quiet continuous-duty cooling initially; 1000-1200 W with a high-end GPU",
        "Avoids paying for GPU headroom before it is needed"
      ],
      [
        "Backup",
        "UPS plus automated external/cloud backups from day one; second host later",
        "Power loss and disk failure must not stop or erase the system"
      ]
    ],
    "buying_rule": "Buy the platform for expandability, not maximum specifications. The minimum viable always-on build is the default; every upgrade needs a workload, reliability or capital-risk trigger.",
    "upgrade_stages": [
      {
        "stage": "Stage 1 \u2014 minimum viable host",
        "trigger": "Buy only after a realized-profit hardware fund can cover it without weakening the trading operation; suitable for demo or low-risk operation after recovery drills pass.",
        "changes": "12-core CPU, 64 GB RAM, one 2 TB NVMe, no dedicated GPU, 850 W Gold PSU, UPS, wired Ethernet and automated off-machine backups."
      },
      {
        "stage": "Stage 2 \u2014 reliability before meaningful live capital",
        "trigger": "Before the host carries money that would be painful to lose, or when one disk/power/network failure is unacceptable.",
        "changes": "ECC-capable 128 GB RAM, mirrored enterprise SSDs, tested restore procedure, monitoring, backup internet and a cold or cloud recovery host."
      },
      {
        "stage": "Stage 3 \u2014 research capacity",
        "trigger": "Upgrade when ingestion queues, PostgreSQL memory pressure or backtest duration is repeatedly limiting work.",
        "changes": "16-core CPU, 256 GB RAM if measured workloads need it, and a separate 4-8 TB data NVMe."
      },
      {
        "stage": "Stage 4 \u2014 local machine learning",
        "trigger": "Only when cloud GPU cost, latency or privacy makes local training economically justified.",
        "changes": "NVIDIA GPU with 16-24 GB or more VRAM, stronger cooling and a 1000-1200 W ATX 3.x PSU."
      }
    ],
    "components": [
      {
        "id": "cpu",
        "name": "Processor",
        "icon": "\ud83e\udde0",
        "x": 30,
        "y": 8,
        "w": 25,
        "h": 20,
        "options": [
          {
            "id": "cpu-base",
            "name": "AMD Ryzen 9 7900X (12-core)",
            "price_new": 400,
            "price_used": 300,
            "impact": "Good baseline for parallel ingestion. Sufficient for most PostgreSQL work.",
            "stage": "Baseline",
            "is_default": true
          },
          {
            "id": "cpu-upgrade",
            "name": "AMD Ryzen 9 7950X (16-core)",
            "price_new": 550,
            "price_used": 450,
            "impact": "Maximized parallel processing. Best for running concurrent experiments and heavy Docker workloads.",
            "stage": "Stage 3: capacity"
          }
        ]
      },
      {
        "id": "ram",
        "name": "Memory",
        "icon": "\u26a1",
        "x": 60,
        "y": 8,
        "w": 20,
        "h": 20,
        "options": [
          {
            "id": "ram-base",
            "name": "64 GB DDR5 (2x32GB)",
            "price_new": 200,
            "price_used": 150,
            "impact": "Minimum for heavy PostgreSQL and containers.",
            "stage": "Baseline",
            "is_default": true
          },
          {
            "id": "ram-upgrade",
            "name": "128 GB DDR5 (4x32GB)",